{
  "$ref": "#/definitions/services",
  "definitions": {
    "services": {
      "type": "object",
      "properties": {
        "name": {
          "type": "string"
        },
        "description": {
          "type": "string"
        },
        "features": {
          "type": "array",
          "items": {
            "type": "string"
          }
        },
        "icon": {
          "type": "string"
        },
        "price": {
          "type": "string"
        },
        "popular": {
          "type": "boolean",
          "default": false
        },
        "$schema": {
          "type": "string"
        }
      },
      "required": [
        "name",
        "description",
        "features",
        "icon"
      ],
      "additionalProperties": false
    }
  },
  "$schema": "http://json-schema.org/draft-07/schema#"
}