{
  "name": "Marketing Automation",
  "description": "Transform your customer journey with modern growth automation practices",
  "features": [
    "Growth strategy development",
    "Marketing funnel optimization",
    "Lead generation campaigns",
    "Email marketing automation"
  ],
  "icon": "automation",
  "price": "24,900 Kƒç",
  "popular": true
}
